{
  "$schema": "http://json-schema.org/draft-07/schema#",
  "type": "object",
  "required": [
    "WD", "BIDS_DIR", "DERIVATIVES_DIR", "FMRIPREP_DIR", "SPACE", "FWHM", "MODELS_FILE", "TASKS"
  ],
  "properties": {
    "WD": {"type": "string"},
    "BIDS_DIR": {"type": "string"},
    "DERIVATIVES_DIR": {"type": "string"},
    "FMRIPREP_DIR": {"type": "string"},
    "SPACE": {"type": "string"},
    "FWHM": {"type": "number"},
    "MODELS_FILE": {"type": "string"},
    "TASKS": {
      "type": "array",
      "items": {"type": "string"},
      "minItems": 1
    },
    "VERBOSITY": {"type": "integer", "minimum": 0, "maximum": 3},
    "SUBJECTS": {
      "type": "array",
      "items": {"type": "string"}
    },
    "ROI": {"type": "boolean"},
    "ROI_CONFIG": {
      "type": "object",
      "properties": {
        "roi_atlas": {"type": "string"},
        "roi_name": {
          "type": "array",
          "items": {"type": "string"}
        },
        "space": {
          "type": "array",
          "items": {"type": "string"}
        }
      },
      "required": ["roi_atlas", "roi_name", "space"]
    }
  },
  "additionalProperties": false
}
