{
  "WD": "/data/local/107_JM01",
  "BIDS_DIR": "/data/local/107_JM01/rawdata",
  "DERIVATIVES_DIR": "/data/local/107_JM01/derivatives",
  "FMRIPREP_DIR": "/data/local/107_JM01/derivatives/fmriprep",
  "SPACE": "MNI152NLin2009cAsym",
  "FWHM": 8,
  "MODELS_FILE": "/data/local/107_JM01/code/old_models/latest_model.json",
  "TASKS": ["pa"],
  "VERBOSITY": 3
}
