{
  "WD": "/Volumes/Thunder/138",
  "BIDS_DIR": "/Volumes/Thunder/138/rawdata",
  "DERIVATIVES_DIR": "/Volumes/Thunder/138/derivatives",
  "FMRIPREP_DIR": "/Volumes/Thunder/138/derivatives/bidspm-preproc",
  "SPACE": "MNI152NLin6Asym",
  "FWHM": 8,
  "MODELS_FILE": "model_d1c.json",
  "TASKS": ["symbol"],
  "ROI": false,
  "ROI_CONFIG": {
    "roi_atlas": "wang",
    "roi_name": ["V1v", "V1d"],
    "space": ["MNI152NLin6Asym"]
  }
}
